{
  "verdict": "approve",
  "summary": "判定: pass。P0=0件 / P1=0件 / P2=2件 / P3=2件。approve 判定の根拠は、PLAN レベルの方向性として構造的前提崩壊・スコープ越境・致命的セキュリティ欠陥がなく、Readiness / Deliverable Adapter / Research+Review の主要技術判断とリスクが本文内で概ね特定されているため。P2/P3 は G3/G4 または finalize 前に明確化すべきだが、実装着手方向性の凍結は阻害しない。",
  "findings": [
    {
      "severity": "medium",
      "title": "§4.3.2 の skip/include 表が L.0 必須ルールと誤読されやすい",
      "body": "§4.5 優先と明記されているため P1 ではないが、表の列名が L1/L2/L3 research のままで、fe の「必要時のみ」や db の「省略可」が残っている。実装者が表だけを参照すると、§4.5.1 の「全駆動タイプで L.0 必須」と逆方向に解釈する余地がある。",
      "file": "docs/plans/PLAN-004-pm-reward-design.md",
      "line_start": 225,
      "line_end": 235,
      "confidence": 0.88,
      "recommendation": "表の列を「主要 sprint の追加 research/深掘り」などに改名するか、L.0 必須とは別枠であることを各セルに明記する。",
      "helix_phase": "L1",
      "dimension_scores": [
        {
          "dimension": "accuracy",
          "level": 3,
          "comment": "優先順位は明記済みだが、表形式が実装解釈を揺らす。"
        },
        {
          "dimension": "maintainability",
          "level": 2,
          "comment": "将来の gate/CLI 実装時に条件分岐を誤実装しやすい。"
        }
      ]
    },
    {
      "severity": "medium",
      "title": "PLAN レビューと G3/G4 の境界表現が一部混線している",
      "body": "PLAN レビューは方向性凍結であり Schema/API Freeze や Implementation Freeze ではないが、§3.4 の表では「本 PLAN 確定（G3）」「本 PLAN 確定（G4）」として記載されている。本文全体の方向性は妥当だが、後続レビューで PLAN 承認済み事項と G3/G4 凍結事項の境界が曖昧になり得る。",
      "file": "docs/plans/PLAN-004-pm-reward-design.md",
      "line_start": 113,
      "line_end": 118,
      "confidence": 0.82,
      "recommendation": "「後続 G3 で凍結」「後続 G4 で凍結」など、PLAN 承認時点ではなく後続 gate の凍結対象であることが分かる表現に変更する。",
      "helix_phase": "L1",
      "dimension_scores": [
        {
          "dimension": "density",
          "level": 4,
          "comment": "対象項目自体は列挙されている。"
        },
        {
          "dimension": "accuracy",
          "level": 3,
          "comment": "PLAN/G3/G4 の責務境界が表現上やや曖昧。"
        }
      ]
    },
    {
      "severity": "low",
      "title": "文書バージョン表記が v4 と v5 で不一致",
      "body": "タイトルと目的節は v4 改訂として記載されている一方、改訂履歴には v5 が最新として記録されている。計画内容の方向性は崩れないが、レビュー対象の版管理と再レビュー証跡が追いにくくなる。",
      "file": "docs/plans/PLAN-004-pm-reward-design.md",
      "line_start": 1,
      "line_end": 5,
      "confidence": 0.9,
      "recommendation": "タイトル、§1.2、§10 の最新行を同じバージョンに揃え、今回レビュー対象が v5 なのか v4 追補なのかを明確化する。",
      "helix_phase": "L1",
      "dimension_scores": [
        {
          "dimension": "accuracy",
          "level": 3,
          "comment": "版管理の事実関係だけが不一致。"
        },
        {
          "dimension": "maintainability",
          "level": 3,
          "comment": "トレース性に影響するが設計方向性は維持されている。"
        }
      ]
    },
    {
      "severity": "low",
      "title": "§4.5.3 の見出し番号が重複している",
      "body": "Mid-sprint insertion と研究結果の再利用がどちらも §4.5.3 になっている。内容の矛盾ではないが、後続 PLAN や gate-policy から参照する際にアンカーが不安定になる。",
      "file": "docs/plans/PLAN-004-pm-reward-design.md",
      "line_start": 308,
      "line_end": 318,
      "confidence": 0.96,
      "recommendation": "後者を §4.5.4 に採番し、関連参照があれば併せて更新する。",
      "helix_phase": "L1",
      "dimension_scores": [
        {
          "dimension": "density",
          "level": 4,
          "comment": "内容自体は不足していない。"
        },
        {
          "dimension": "maintainability",
          "level": 3,
          "comment": "参照安定性の問題。"
        }
      ]
    }
  ],
  "overall_scores": [
    {
      "dimension": "density",
      "level": 4,
      "comment": "A/B/C/D、リスク、Sprint 7-10、関連 PLAN が網羅されている。"
    },
    {
      "dimension": "depth",
      "level": 4,
      "comment": "Readiness の Layer 0-3、carry ルール、adapter MVP まで PLAN レベルとして十分に掘れている。"
    },
    {
      "dimension": "breadth",
      "level": 4,
      "comment": "API/DB/外部形式/セキュリティ/移行/研究レビュー運用まで主要領域を見ている。"
    },
    {
      "dimension": "accuracy",
      "level": 3,
      "comment": "方向性は正しいが、skip/include 表と gate 境界表現に G3/G4 前の明確化余地がある。"
    },
    {
      "dimension": "maintainability",
      "level": 3,
      "comment": "構成は保守可能だが、版表記と見出し重複が参照性を落としている。"
    }
  ],
  "next_steps": [
    "P2: §4.3.2 の表を L.0 必須ルールと衝突しない表現へ修正する。",
    "P2: §3.4 の G3/G4 表現を PLAN レビュー時点の承認範囲と後続 gate 凍結範囲に分離する。",
    "P3: 文書バージョンを v4/v5 のどちらかに統一する。",
    "P3: 重複している §4.5.3 を採番修正する。"
  ]
}
