{
  "verdict": "approve",
  "summary": "判定: pass。P0/P1/P2/P3 の件数: 0/0/0/1。approve 判定の根拠: PLAN レベルとして L9-L11 の目的、入出力、成果物、G9-G11、L7/G7/L8/L9 境界、G10 outcome、Run 成果物の redaction/retention/access control、CLI/state/gate 反映方針が特定されている。構造的矛盾・前提崩壊・スコープ越境・致命的セキュリティ欠陥に相当する P0/P1 はない。残件は G10 outcome mapping 表の旧ヘッダー残存のみで、PLAN 方向性凍結は阻害しない。",
  "overall_scores": [
    {
      "dimension": "density",
      "level": 4,
      "comment": "Run 工程に必要な phase/gate/成果物/既存 PLAN 接続/セキュリティ境界は概ね網羅されている。"
    },
    {
      "dimension": "depth",
      "level": 4,
      "comment": "L7/G7/L8/L9 境界、G10 outcome、raw 非保存方針まで PLAN レベルとして十分掘り下げられている。"
    },
    {
      "dimension": "breadth",
      "level": 4,
      "comment": "deploy、observability、postmortem、scrum、reverse、readiness への接続が整理されている。"
    },
    {
      "dimension": "accuracy",
      "level": 4,
      "comment": "主要な技術判断は正確で、G10 pass 条件も fail-close に整合している。残る不整合は表記上の P3 のみ。"
    },
    {
      "dimension": "maintainability",
      "level": 4,
      "comment": "章立てと責務分離は追いやすい。G10 outcome 表の旧ヘッダーだけ削除すれば後続 L3 へ転記しやすい。"
    }
  ],
  "findings": [
    {
      "severity": "low",
      "title": "P3: G10 outcome mapping 表に旧ヘッダー行が残っている",
      "body": "§3.4.1 の outcome mapping で、旧 4 列ヘッダーが残ったまま新 5 列ヘッダーが続いている。意味は新 5 列表から読み取れるため PLAN 承認は阻害しないが、L3 詳細設計や gate-checks.yaml へ転記する際に表構造の誤読を招く可能性がある。",
      "file": "docs/plans/PLAN-009-run-phase-l9-l11.md",
      "line_start": 149,
      "line_end": 152,
      "confidence": 0.98,
      "recommendation": "149-150 行の旧 4 列ヘッダーを削除し、151-156 行の 5 列表だけを正として残す。",
      "helix_phase": "L1/PLAN_REVIEW",
      "dimension_scores": [
        {
          "dimension": "accuracy",
          "level": 4,
          "comment": "意味上の gate outcome は正しく定義済みで、誤りは表記整形に限定される。"
        },
        {
          "dimension": "maintainability",
          "level": 3,
          "comment": "表構造の重複により後続仕様化時の可読性が少し落ちる。"
        }
      ]
    }
  ],
  "next_steps": [
    "PLAN-009 v3.3 は PLAN レベルとして approve 扱いにする。",
    "L3 詳細設計前に G10 outcome mapping 表の旧ヘッダー行を削除する。",
    "L3 では CLI 引数仕様、phase.yaml 許容値/遷移条件、gate-checks.yaml フォーマット、G9-G11 自動検証スクリプト接続を凍結する。"
  ]
}
