{
  "verdict": "approve",
  "summary": "判定: pass（verdict=approve）。P0/P1/P2/P3 の件数: 0/0/1/0。approve 判定の根拠: 5 系統の目的、I/O、R0-R4/RGC 接続、type 別 gate mapping、RGC lifecycle 分離、upgrade の assessment-only 境界、fullback redaction 境界が PLAN レベルで特定されており、構造的矛盾・前提崩壊・スコープ越境・致命的セキュリティ欠陥は確認されない。残る指摘は CLI 契約の形式表現に関する G3 詳細化事項であり、PLAN 方向性凍結は阻害しない。",
  "overall_scores": [
    {
      "dimension": "density",
      "level": 4,
      "comment": "5 系統定義、gate mapping、RGC 適用基準、redaction、CLI 互換、関連 PLAN、リスクまで網羅されている。正規 grammar の小さな欠落のみ残る。"
    },
    {
      "dimension": "depth",
      "level": 4,
      "comment": "RGC を run から分離し、upgrade/fullback/design の責務差も PLAN レベルとして十分に掘られている。"
    },
    {
      "dimension": "breadth",
      "level": 4,
      "comment": "Code/Upgrade/Normalization/Fullback/Design、Forward L2/L6/L8/L9-L11、PLAN-006/007/009/010 連携まで目配りされている。"
    },
    {
      "dimension": "accuracy",
      "level": 4,
      "comment": "前回 P1 の R3 optional、RGC lifecycle、raw export 矛盾は解消済み。CLI grammar 表の `rgc` 欠落は L3 で修正すべき。"
    },
    {
      "dimension": "maintainability",
      "level": 4,
      "comment": "type × stage matrix と redaction 境界により実装分岐は追いやすい。grammar を単一ソース化すればさらに安定する。"
    }
  ],
  "findings": [
    {
      "severity": "medium",
      "title": "[P2] 正規 CLI grammar が `rgc` subcommand を列挙していない",
      "body": "§3.7 の正規 grammar は `helix reverse <type> [<stage|run|status|retry>]` としており、§3.7.2 で定義する `rgc` subcommand と §3.7.3 の既存互換 `helix reverse rgc` が形式上表現されていない。本文で挙動は説明されているため PLAN 凍結は阻害しないが、L3 の D-CONTRACT 化時に parser 実装者が `rgc` を漏らす余地がある。",
      "file": "docs/plans/PLAN-008-reverse-multitype.md",
      "line_start": 249,
      "line_end": 290,
      "confidence": 0.86,
      "recommendation": "L3 詳細設計で grammar を `helix reverse <type> [<stage|run|rgc|status|retry>] ...` のように更新し、`helix reverse rgc` の code alias と type 別 `rgc` の対応を option schema に明記する。",
      "helix_phase": "PLAN_REVIEW",
      "dimension_scores": [
        {
          "dimension": "accuracy",
          "level": 3,
          "comment": "本文の挙動定義と形式 grammar に軽微な不一致がある。"
        },
        {
          "dimension": "maintainability",
          "level": 3,
          "comment": "CLI parser 実装時の仕様参照先が分散しやすい。"
        }
      ]
    }
  ],
  "next_steps": [
    "PLAN-008 は PLAN レベル approve として扱い、L3 詳細設計で `rgc` を含む CLI grammar / option schema を D-CONTRACT に確定する。",
    "既存 `.helix/plans/PLAN-008.yaml` の review status は旧 needs-attention のままなので、本レビュー結果を保存する運用に合わせて reviewed/approve へ更新する。"
  ]
}
