{
  "verdict": "approve",
  "summary": "判定=pass/approve。P0=0件、P1=0件、P2=3件、P3=1件。approve 判定の根拠: PLAN-013 は eligible taxonomy の分離、PoC seed と coverage gate の責務分離、v15 migration、warning/target 運用の主要方針とリスクを十分に特定しており、PLAN レベルの方向性として実装着手可能。残る指摘は G3 Schema/API Freeze までに契約を明確化すべき事項で、現時点の方向性凍結を阻害しない。",
  "overall_scores": [
    {
      "dimension": "density",
      "level": 4,
      "comment": "目的、in/out scope、migration、CLI、受入条件、リスクが概ね網羅されている。"
    },
    {
      "dimension": "depth",
      "level": 4,
      "comment": "bucket と seed metadata の責務分離、coverage 指標との分離まで踏み込めている。"
    },
    {
      "dimension": "breadth",
      "level": 4,
      "comment": "DB、JSONL、CLI、migration、debt、運用 gate まで広く扱えている。"
    },
    {
      "dimension": "accuracy",
      "level": 3,
      "comment": "方向性は妥当だが、line_no の同定規則、JSON 出力形、既存 ignore 契約の継承に G3 前の精密化が必要。"
    },
    {
      "dimension": "maintainability",
      "level": 3,
      "comment": "段階導入は保守しやすいが、出力契約と節番号の揺れを整理すると後続実装の解釈コストが下がる。"
    }
  ],
  "findings": [
    {
      "severity": "medium",
      "title": "P2: path+line_no の同定対象が marker 行か symbol 行か未凍結",
      "body": "`--uncovered` の covered/uncovered 判定を `path + line_no` で同定するとしているが、既存 catalog の `line_no` は `@helix:index` marker 行で、AST 側の symbol 行とは一致しない可能性がある。PLAN レベルでは方向性を阻害しないが、G3 までに canonical key を marker_line / symbol_line / 両方保持のいずれかへ凍結しないと、既存 covered entry が false uncovered になるリスクがある。",
      "file": "docs/plans/PLAN-013-code-index-eligibility-taxonomy.md",
      "line_start": 181,
      "line_end": 185,
      "confidence": 0.87,
      "recommendation": "G3 で `line_no` の意味を明文化し、必要なら `symbol_line` と `marker_line` を分離する。既存 v14 migration fixture で marker 行と symbol 行がずれるケースを必ず検証する。",
      "helix_phase": "L1",
      "dimension_scores": [
        {
          "dimension": "accuracy",
          "level": 3,
          "comment": "識別キーの仕様が曖昧。"
        },
        {
          "dimension": "maintainability",
          "level": 3,
          "comment": "後続実装で解釈差が出やすい。"
        }
      ]
    },
    {
      "severity": "medium",
      "title": "P2: covered entry の CLI JSON 形が flat と nested metadata で揺れている",
      "body": "`--uncovered 出力 schema` では covered entry に `metadata.seed_candidate` / `metadata.seed_promotable` を含めると読める一方、JSON 例と受入条件は item 直下の `seed_candidate` / `seed_promotable` を要求している。source-of-truth が JSONL nested、CLI 出力が flat という意図なら、その変換規則を明記する必要がある。",
      "file": "docs/plans/PLAN-013-code-index-eligibility-taxonomy.md",
      "line_start": 183,
      "line_end": 185,
      "confidence": 0.9,
      "recommendation": "CLI 外部契約は flat item に統一し、JSONL 内部保存のみ `metadata.*` とする、など入出力境界を G3 で凍結する。",
      "helix_phase": "L1",
      "dimension_scores": [
        {
          "dimension": "density",
          "level": 4,
          "comment": "必要要素は揃っているが正規形の宣言が不足。"
        },
        {
          "dimension": "accuracy",
          "level": 3,
          "comment": "API 出力形の表現が不一致。"
        }
      ]
    },
    {
      "severity": "medium",
      "title": "P2: PLAN-012 の対象外 path 契約の継承が明示されていない",
      "body": "`--uncovered` の母集団を全 top-level symbol とする方針は妥当だが、PLAN-012 で対象外だった `test_*.py`、`tests/`、`fixture/`、`generated/`、`vendor/` などを PLAN-013 で pre-filter として維持するのか、bucket 分類へ入れるのかが明示されていない。固定 3 pattern の `excluded` だけだと、既存 coverage 母数が意図せず拡大する可能性がある。",
      "file": "docs/plans/PLAN-013-code-index-eligibility-taxonomy.md",
      "line_start": 180,
      "line_end": 180,
      "confidence": 0.82,
      "recommendation": "bucket 判定前の candidate file filter として PLAN-012 の対象外 path を維持するか、明示的に `excluded` とは別の non-indexable 対象として定義する。",
      "helix_phase": "L1",
      "dimension_scores": [
        {
          "dimension": "breadth",
          "level": 3,
          "comment": "既存 ignore 契約への目配りが不足。"
        },
        {
          "dimension": "accuracy",
          "level": 3,
          "comment": "母数が変わるリスクが残る。"
        }
      ]
    },
    {
      "severity": "low",
      "title": "P3: §3.3 の subsection 順序が 3.3.4 から 3.3.2 へ戻っている",
      "body": "PoC seed 補足が §3.3.4 として §3.3.2 / §3.3.3 より前に配置されており、参照時に軽微な混乱が起きる。契約内容自体は読み取れるため approve 阻害ではない。",
      "file": "docs/plans/PLAN-013-code-index-eligibility-taxonomy.md",
      "line_start": 193,
      "line_end": 223,
      "confidence": 0.95,
      "recommendation": "finalize 前に §3.3.2 以降の節番号を順序どおりに振り直す。",
      "helix_phase": "L1",
      "dimension_scores": [
        {
          "dimension": "maintainability",
          "level": 4,
          "comment": "軽微な参照性の問題。"
        }
      ]
    }
  ],
  "next_steps": [
    "G3 までに `line_no` の canonical semantics と covered/uncovered matching key を凍結する。",
    "CLI JSON 外部契約を flat item へ統一するか、nested metadata を外部契約にするかを明記する。",
    "PLAN-012 の対象外 path 契約を PLAN-013 の pre-filter として継承するかを明文化する。",
    "finalize 時に §3.3 の節番号と付録 B の v1.4 review 結果を更新する。"
  ]
}
