{
  "verdict": "approve",
  "summary": "P0=0/P1=0/P2=1/P3=1。構造的矛盾、前提崩壊、スコープ越境、致命的セキュリティ欠陥は確認されないため approve。HELIX_TEST_TODAY guard を削除し、cost_log INSERT を通常動作へ戻し、DoD #3 を fixture 0 件 + 1 回実行へ再設計する方向性は妥当。P2/P3 は G3/G4 までに詰めるべき検証詳細・説明精度の問題であり、PLAN レベルの実装着手判断は阻害しない。",
  "findings": [
    {
      "severity": "medium",
      "title": "DoD #5 の収束確認手順が G4 判定としてまだ曖昧",
      "body": "DoD #5 は並行発火直後の DB count == summary count を要求せず、後続 1 回実行後の一致まで猶予する方針を定義しているが、G4 で何を実行して PASS とするかがテストまたは手動検証手順として固定されていない。方向性は妥当だが、G4 で判定者ごとの解釈差が出る可能性がある。",
      "file": "docs/plans/PLAN-015-stop-hook-test-guard-hack.md",
      "line_start": 129,
      "line_end": 133,
      "confidence": 0.84,
      "recommendation": "G4 判定基準に、並行実行後に追加で run_session_summary を 1 回実行し、date(created_at)=TODAY の DB 件数と summary の「終了 N 回」が一致することを確認する、という具体手順を追加する。",
      "helix_phase": "L4",
      "dimension_scores": [
        {
          "dimension": "depth",
          "level": 3,
          "comment": "eventual consistency の方針はあるが、検証条件の具体化が不足"
        },
        {
          "dimension": "accuracy",
          "level": 3,
          "comment": "G4 判定時の PASS 条件が一意に固定されていない"
        }
      ]
    },
    {
      "severity": "low",
      "title": "created_at 未指定時の時刻発生源の説明が実装実態とずれている",
      "body": "PLAN は現行挙動を DB 側の CURRENT_TIMESTAMP と説明しているが、実装上は helix_db.py の insert_row が created_at 未指定時に Python の datetime.now().isoformat() を注入している。mock 日付に hit しないという問題認識と created_at 明示注入の方針は正しいが、根拠説明は修正した方がよい。",
      "file": "docs/plans/PLAN-015-stop-hook-test-guard-hack.md",
      "line_start": 53,
      "line_end": 53,
      "confidence": 0.91,
      "recommendation": "「DB 側の CURRENT_TIMESTAMP」ではなく「helix_db.py の insert_row が実時刻 datetime.now().isoformat() を補完する」と記述し、created_at 明示注入の理由を実装に合わせる。",
      "helix_phase": "L4",
      "dimension_scores": [
        {
          "dimension": "accuracy",
          "level": 3,
          "comment": "補足説明に実装実態との不一致がある"
        },
        {
          "dimension": "maintainability",
          "level": 4,
          "comment": "方針自体は保守性を損なわないが、将来レビュー時の誤読を防ぐ修正が望ましい"
        }
      ]
    }
  ],
  "overall_scores": [
    {
      "dimension": "density",
      "level": 4,
      "comment": "目的、scope、DoD、互換性、リスク、Sprint が揃っており、PLAN レビューに必要な情報は概ね充足"
    },
    {
      "dimension": "depth",
      "level": 4,
      "comment": "guard 削除だけでなく created_at と並行発火時の収束まで掘れているが、DoD #5 の検証手順は追加余地あり"
    },
    {
      "dimension": "breadth",
      "level": 4,
      "comment": "既存 DoD、DB スキーマ非変更、並行安全、後続候補まで目配りされている"
    },
    {
      "dimension": "accuracy",
      "level": 4,
      "comment": "主要な実装方向は既存コードと整合。created_at の時刻発生源説明に軽微な不正確さあり"
    },
    {
      "dimension": "maintainability",
      "level": 4,
      "comment": "変更範囲が小さく、既存テスト中心で進める方針。G4 検証条件を明文化すればさらに安定する"
    }
  ],
  "next_steps": [
    "G3/G4 までに DoD #5 の具体的な収束確認手順を PLAN に追記する",
    "created_at 未指定時の説明を helix_db.py の実装に合わせて修正する",
    "そのうえで PLAN-015 の方向性として L4 実装へ進めてよい"
  ]
}
