{
  "verdict": "approve",
  "summary": "P0/P1/P2/P3: 0/0/4/1。approve 判定の根拠: PLAN-005 は single-host 前提、CLI 受け口、5 shared infra skills、v11 migration、PLAN-002/003 接続点、allowlist/fail-closed/redaction など主要な技術判断とリスクを概ね特定しており、方向性として実装着手可能。阻害要因となる構造的矛盾、前提崩壊、スコープ越境、致命的セキュリティ欠陥は確認されない。残件は G3 Schema/API Freeze または G4 実装前に解消すべき詳細化事項。",
  "findings": [
    {
      "severity": "medium",
      "title": "task 形式の delimiter 仕様が曖昧",
      "body": "`--task` は `<type>:<payload>` と定義されている一方、type 自体が `helix:command` / `shell:script` / `http:webhook` のように colon を含むため、単純 split 実装では payload 境界が不安定になる。PLAN レベルの方向性は妥当だが、G3 で executor ごとの canonical parse rule を固定しないと scheduler/job-queue で解釈差が出る。",
      "file": "docs/plans/PLAN-005-ops-automation-skills.md",
      "line_start": 119,
      "line_end": 127,
      "confidence": 0.9,
      "recommendation": "G3 で longest-prefix match、明示 JSON 形式、または executor 別 schema のいずれかに統一し、scheduler/job-queue 共通の parser contract と fixture を追加する。",
      "helix_phase": "G3"
    },
    {
      "severity": "medium",
      "title": "http:webhook の外部送信リスクがリスク台帳に独立していない",
      "body": "`http:webhook` executor は HTTPS allowlist に限定されているため PLAN 承認を阻害しないが、外部 API/egress 経路、SSRF 類似リスク、送信 payload の秘匿情報混入、失敗時 retry の副作用が R-xx として独立管理されていない。",
      "file": "docs/plans/PLAN-005-ops-automation-skills.md",
      "line_start": 121,
      "line_end": 127,
      "confidence": 0.86,
      "recommendation": "G3 までに `http:webhook` 用の R-08 を追加し、allowlist URL 正規化、payload redaction、retry の冪等性、G1R/G3 外部 API 契約レビュー要否を明記する。",
      "helix_phase": "G3"
    },
    {
      "severity": "medium",
      "title": "retention の削除手順が VACUUM と混同されている",
      "body": "events/metrics の 90 日 retention で「超過は VACUUM」とあるが、SQLite の VACUUM は削除済み領域の再編成であり、期限超過レコードの削除そのものではない。秘匿情報境界に関わるため、G3 で削除条件と VACUUM の順序を分けて凍結する必要がある。",
      "file": "docs/plans/PLAN-005-ops-automation-skills.md",
      "line_start": 468,
      "line_end": 472,
      "confidence": 0.92,
      "recommendation": "`DELETE FROM events/metrics WHERE created_at < cutoff` の後に必要時のみ `VACUUM` を行う方針へ修正し、cleanup job の dry-run と fail-closed 条件をテスト観点へ追加する。",
      "helix_phase": "G3"
    },
    {
      "severity": "medium",
      "title": "v11 追加テーブル数の記述が実体と一致しない",
      "body": "`本 PLAN は v11 で5テーブルを追加` とあるが、直後の一覧と各 DDL では `schedules`, `jobs`, `locks`, `setup_checks`, `setup_events`, `events`, `metrics` の 7 物理テーブルを追加している。方向性は崩れないが、migration freeze 時のレビュー観点にずれが出る。",
      "file": "docs/plans/PLAN-005-ops-automation-skills.md",
      "line_start": 518,
      "line_end": 532,
      "confidence": 0.95,
      "recommendation": "表現を「5 skill 分、7 物理テーブルを追加」に統一し、受入チェックリストと migration rehearsal matrix でも同じ数え方を使う。",
      "helix_phase": "G3"
    },
    {
      "severity": "low",
      "title": "`--include-secrets` の意味が redaction 方針と衝突し得る",
      "body": "export は redaction 済みデータのみ許可するとしつつ、`--include-secrets` も定義されている。PM-only 承認と監査ログにより PLAN 承認を阻害しないが、保存時 redaction 後に何を include するのかが曖昧で、実装時に秘匿情報復元や例外経路として誤解される余地がある。",
      "file": "docs/plans/PLAN-005-ops-automation-skills.md",
      "line_start": 461,
      "line_end": 466,
      "confidence": 0.82,
      "recommendation": "G3 で `--include-secrets` を削除するか、redaction 後の masked fields metadata のみを含める等、秘密値そのものを出力しない仕様として明文化する。",
      "helix_phase": "G3"
    }
  ],
  "next_steps": [
    "G2: PLAN の方向性は approve とし、5 shared infra skills の共通化方針で L3 詳細化へ進む。",
    "G3: task parser contract、http:webhook 外部送信リスク、retention cleanup、v11 物理テーブル数、export secret flag の仕様を凍結する。",
    "G4: allowlist fail-closed、migration rehearsal、redaction fixture、lock acquisition order、scheduler/job idempotency を実装テストで確認する。"
  ]
}
