{
  "verdict": "approve",
  "summary": "Retroactive approval for T2 LLM Guard hardening. The original implementation lacked a PLAN, but PLAN-018 now records scope, gate evidence, process violation, and full regression evidence. Approval is limited to remediation closure and does not waive the original HELIX flow violation.",
  "overall_scores": [
    {
      "dimension": "density",
      "level": 4,
      "comment": "Scope, guards, acceptance evidence, and retro process notes are explicit."
    },
    {
      "dimension": "depth",
      "level": 4,
      "comment": "Covers raw LLM, research, role policy, context guard, and gate/test evidence."
    },
    {
      "dimension": "breadth",
      "level": 4,
      "comment": "Includes hook, wrapper, CLI, docs, skills, and tests."
    },
    {
      "dimension": "accuracy",
      "level": 4,
      "comment": "Evidence reflects current G2/G3/G4 dry-run and ./cli/helix test results."
    },
    {
      "dimension": "maintainability",
      "level": 4,
      "comment": "Moves enforcement from prompt-only discipline into code and hook checks."
    }
  ],
  "findings": [],
  "next_steps": [
    "Future L-size workflow/guard changes must start from .helix/plans YAML plus docs/plans markdown before implementation."
  ]
}
