{
  "verdict": "approve",
  "summary": "P0=0, P1=0, P2=2, P3=1。approve 判定の根拠: PLAN レベルでは、棚卸し基盤を Phase 0/A0/A1/audit_decisions v8 migration に分離する方向性、PLAN-003 との境界、DB/監査/同期/検証ゲートの主要リスクが明示されており、構造的矛盾・前提崩壊・スコープ越境・致命的セキュリティ欠陥は確認されない。P2/P3 は G3/G4 までに凍結・補正すべき詳細であり、実装着手方向の阻害要因ではない。",
  "findings": [
    {
      "severity": "medium",
      "title": "P2: schema_version の空テーブル/0 扱いが migration 分岐で未確定",
      "body": "migration preflight は schema_version 欠落時と MAX(version) 評価時を定義しているが、schema_version テーブルが存在して行がない場合、または current=0 と評価される場合の扱いが明示されていない。一方で対象バージョン行列には「0 (空 DB)」が含まれるため、G3 Schema Freeze までに current=0/NULL を v8 初期化・fail-closed・repair 誘導のどれに分類するかを固定する必要がある。",
      "file": "docs/plans/PLAN-002-helix-inventory-foundation.md",
      "line_start": 257,
      "line_end": 288,
      "confidence": 0.86,
      "recommendation": "G3 で schema_version テーブル存在かつ MAX(version) が NULL/0 のケースを対象バージョン行列とテスト計画に追加し、期待動作を明記する。",
      "helix_phase": "G3"
    },
    {
      "severity": "medium",
      "title": "P2: raw quarantine の保持・削除・アクセス統制を G2/G3 で明文化する必要がある",
      "body": "raw 生ログを repo 外に分離し mode 0600 とする方針は妥当だが、90日保管または即時破棄の選択基準、削除確認、失敗時の扱い、legacy DB backup と同じ quarantine 配下でのアクセス統制が PLAN レベルでは未確定。秘匿情報を含み得るログ/DB 退避なので、G2 threat model と G3 migration/runbook 詳細で扱うべき重要リスクとして残る。",
      "file": "docs/plans/PLAN-002-helix-inventory-foundation.md",
      "line_start": 101,
      "line_end": 105,
      "confidence": 0.82,
      "recommendation": "G2 threat model に quarantine データの漏洩・残存リスクを追加し、G3 で retention、cleanup、backup mode、削除検証ログ、AUDIT_QUARANTINE=disabled 時の証跡を凍結する。",
      "helix_phase": "G2/G3"
    },
    {
      "severity": "low",
      "title": "P3: 文書ヘッダの版数が改訂履歴とずれている",
      "body": "文書タイトルは v2 のままだが、改訂履歴では最新が v5 とされている。計画方向性には影響しないが、PLAN レビュー証跡や後続 G2/G3 の参照時に版数混乱を招く。",
      "file": "docs/plans/PLAN-002-helix-inventory-foundation.md",
      "line_start": 1,
      "line_end": 1,
      "confidence": 0.95,
      "recommendation": "ヘッダの版数を改訂履歴の最新 v5 に揃える。",
      "helix_phase": "L2"
    }
  ],
  "next_steps": [
    "PLAN-002 は方向性 approve とし、G2 設計凍結へ進める。",
    "G2 で threat model、adversarial-review、redaction/quarantine リスクを証跡化する。",
    "G3 で schema_version 0/NULL、quarantine 運用、DDL/CHECK/transaction 境界、A1 source-of-truth を凍結する。",
    "文書ヘッダの版数を v5 に補正してレビュー証跡の参照混乱を避ける。"
  ]
}
