{
  "verdict": "approve",
  "summary": "P0=0 / P1=0 / P2=4 / P3=1。approve 判定の根拠: PLAN レベルでは、HMAC・HOME DB・hook materialization・CURRENT v2・残量警告を PLAN-002 から切り出す方向性、主要リスク、PoC/調査ゲート、B/D 判定軸分離が整理されており、構造的矛盾・前提崩壊・スコープ越境・致命的セキュリティ欠陥は確認されない。以下は G3 Schema/Contract Freeze までに凍結すべき詳細であり、実装着手方針の阻害要因ではない。",
  "findings": [
    {
      "severity": "medium",
      "title": "G1R/G1.5 のライフサイクルが L6/L8 検証と混在している",
      "body": "G1R/G1.5 は通常は事前調査・PoC のゲートだが、L6 検証と L8 受入でも同名の結合検証として扱われている。PLAN 方針としては妥当だが、G3 までに「事前 PoC ゲート」と「実装後の回帰・受入テスト」を証跡上分離しないと、どの成果物が実装着手の前提で、どれがリリース前検証なのかが曖昧になる。",
      "file": "docs/plans/PLAN-003-auto-restart-foundation.md",
      "line_start": 87,
      "line_end": 98,
      "confidence": 0.86,
      "recommendation": "G3 までに G1R/G1.5 は事前ゲート、L6/L8 は同一シナリオを再利用する regression/acceptance suite などとして命名・証跡を分ける。",
      "helix_phase": "G3"
    },
    {
      "severity": "medium",
      "title": "scope_hash が HMAC canonical 入力へ明示的に束縛されていない",
      "body": "PLAN 全体では scope_hash を B/D outcome と再実行基準の中核として扱っている一方、HMAC canonical JSON の署名対象フィールドには scope_hash が明示されていない。handover_manifest_hash 等に間接的に含める設計でも成立するが、どの不変条件で scope drift を拒否するのかが PLAN 上は読み取りにくい。",
      "file": "docs/plans/PLAN-003-auto-restart-foundation.md",
      "line_start": 147,
      "line_end": 158,
      "confidence": 0.82,
      "recommendation": "D-HOOK-SPEC で scope_hash を署名対象に追加するか、handover_manifest_hash 内に必ず含まれることを明記し、scope_hash 不一致時の fail-closed テストを G3 の受入に入れる。",
      "helix_phase": "G3"
    },
    {
      "severity": "medium",
      "title": "CURRENT v2 と handover_manifest_hash の正規化境界が未凍結",
      "body": "handover_manifest_hash は CURRENT.json を含む handover 参照ファイルを hash 化する一方、CURRENT schema v2 は legacy input / normalized output の adapter を持つ方針になっている。raw CURRENT.json、legacy input、normalized output のどれを署名・比較対象にするかが未確定だと、互換 adapter の変更で false reject または false accept が起き得る。",
      "file": "docs/plans/PLAN-003-auto-restart-foundation.md",
      "line_start": 237,
      "line_end": 245,
      "confidence": 0.84,
      "recommendation": "G3 で CURRENT v2 の hash 対象を raw bytes / parsed canonical / normalized output のいずれかに固定し、adapter 適用順と schema_version の扱いを D-CURRENT と D-HOOK-SPEC に明記する。",
      "helix_phase": "G3"
    },
    {
      "severity": "medium",
      "title": "rate limit の集計キーが未定義",
      "body": "1時間あたり6回の rate limit は安全境界として妥当だが、global、task_id、cwd、resume_id、user 単位のどれで集計するかが未定義。ここが曖昧だと、正当な複数タスクを過剰に止めるか、逆に単一タスクの restart 連打を抑止できない可能性がある。",
      "file": "docs/plans/PLAN-003-auto-restart-foundation.md",
      "line_start": 192,
      "line_end": 193,
      "confidence": 0.8,
      "recommendation": "D-HOME-DB で rate limit の集計キー、clock source、reject 時の decision 値、テスト条件を固定する。",
      "helix_phase": "G3"
    },
    {
      "severity": "low",
      "title": "文書メタデータの版数と節番号が不整合",
      "body": "タイトルは v1 のままだが改訂履歴では v2 反映済みになっている。また 8.3 が追加仕様ファイルと trust boundary で重複している。レビュー判定を阻害しないが、finalize 前に修正した方が追跡性が上がる。",
      "file": "docs/plans/PLAN-003-auto-restart-foundation.md",
      "line_start": 1,
      "line_end": 1,
      "confidence": 0.95,
      "recommendation": "タイトルを現在版に合わせ、後続の 8.3 trust boundary を 8.4 などに renumber する。",
      "helix_phase": "G2"
    }
  ],
  "next_steps": [
    "PLAN-003 は approve とし、この方向性で L2/L3 詳細化へ進めてよい。",
    "G3 までに G1R/G1.5 と L6/L8 検証の証跡名を分離する。",
    "D-HOOK-SPEC / D-CURRENT / D-HOME-DB で scope_hash、CURRENT hash 正規化、rate limit 集計キーを凍結する。",
    "finalize 前に版数と節番号の文書整合を直す。"
  ]
}
