{
  "verdict": "approve",
  "summary": "P0/P1/P2/P3 = 0/0/2/2。構造的矛盾・前提崩壊・スコープ越境・致命的セキュリティ欠陥はなく、Stop hook の append-only 出力を当日単位で rewrite-aware にする方向性は妥当なため approve。P2 は G3/G4 までにファイル更新の排他性と日付/ファイル単位の期待値を凍結すべき事項。",
  "overall_scores": [
    {
      "dimension": "density",
      "level": 4,
      "comment": "目的、スコープ、DoD、リスク、実装対象が概ね揃っている。テスト期待値の表記ゆれが残る。"
    },
    {
      "dimension": "depth",
      "level": 3,
      "comment": "rewrite 方針は十分だが、排他更新や日付境界の実装詳細は G3/G4 に持ち越し。"
    },
    {
      "dimension": "breadth",
      "level": 4,
      "comment": "DB/schema、他 hook、過去ファイル、report 系を out-of-scope として切れている。並行発火リスクの明示が不足。"
    },
    {
      "dimension": "accuracy",
      "level": 4,
      "comment": "現行実装の append-only 挙動と cost_log/hook_events 集計前提に合っている。日付ブロックとテスト regex に軽微な不整合がある。"
    },
    {
      "dimension": "maintainability",
      "level": 4,
      "comment": "単一 CLI と bats に閉じる小規模改修として保守しやすい。更新ロジックの原子性を設計に追加するとより安定する。"
    }
  ],
  "findings": [
    {
      "severity": "medium",
      "title": "rewrite 更新時の排他性がリスクとして未定義",
      "body": "PLAN は当日ブロックを read/cut/replace する方針を示しているが、Stop hook が短時間に複数回発火すること自体が課題なので、2 プロセスが同時に同じ summary_file を rewrite した場合の lost update や部分書き込み対策が未定義。PLAN 方向性は妥当だが、G3/G4 までに flock や temp file + atomic rename などの更新方式を凍結する必要がある。",
      "file": "docs/plans/PLAN-014-stop-hook-idempotency.md",
      "line_start": 56,
      "line_end": 59,
      "confidence": 0.84,
      "recommendation": "ファイル更新アルゴリズムに排他ロック、temp file 生成、fsync/rename または同等の atomic update 方針を追記し、可能なら並行起動を模した bats ケースを G4 DoD に追加する。",
      "helix_phase": "L4",
      "dimension_scores": [
        {
          "dimension": "breadth",
          "level": 3,
          "comment": "並行発火という主要リスクの一部が未カバー。"
        },
        {
          "dimension": "accuracy",
          "level": 3,
          "comment": "単発実行前提では正しいが同時実行時の正確性が未確定。"
        },
        {
          "dimension": "maintainability",
          "level": 3,
          "comment": "更新方式が曖昧だと後続実装が分岐しやすい。"
        }
      ]
    },
    {
      "severity": "medium",
      "title": "日付単位の期待値がファイル単位かブロック単位か曖昧",
      "body": "現行仕様は .helix/session-summaries/<TODAY>-session.md という日次ファイルだが、DoD では date モック 2 日分で『別日のブロックは保存される』と記載されている。2 日分を 2 ファイルとして検証するのか、1 ファイル内の 2 ブロックとして検証するのかが曖昧で、テスト設計時に解釈が割れる可能性がある。",
      "file": "docs/plans/PLAN-014-stop-hook-idempotency.md",
      "line_start": 74,
      "line_end": 75,
      "confidence": 0.78,
      "recommendation": "G3 で『日次ファイルごとに新形式ブロック 1 つ』または『単一ファイル内で日付別ブロック複数』のどちらを正とするか明記し、DoD #2 の期待値をファイル数・ブロック数・対象パスまで具体化する。",
      "helix_phase": "L4",
      "dimension_scores": [
        {
          "dimension": "density",
          "level": 3,
          "comment": "検証対象の成果物粒度が不足。"
        },
        {
          "dimension": "accuracy",
          "level": 3,
          "comment": "現行ファイル命名との対応が曖昧。"
        },
        {
          "dimension": "maintainability",
          "level": 3,
          "comment": "曖昧なテスト期待値は後続保守で誤解を生みやすい。"
        }
      ]
    },
    {
      "severity": "low",
      "title": "旧ヘッダ grep と新ヘッダ grep が混在している",
      "body": "in-scope の検証例は `^## セッション終了` を 1 件とする一方、§3.1 の新形式ヘッダと DoD #1 は `## <date> セッション (最終更新...)` を前提にしている。PLAN レベルでは approve を阻害しないが、failing test 作成前に期待 regex を一本化しないと旧フォーマット互換テストと idempotency テストが混線する。",
      "file": "docs/plans/PLAN-014-stop-hook-idempotency.md",
      "line_start": 29,
      "line_end": 31,
      "confidence": 0.92,
      "recommendation": "line 30 の検証例を DoD #1 と同じ新ヘッダ regex に揃え、旧フォーマットは『破壊しない』互換性ケースとして別 assertion に分離する。",
      "helix_phase": "L4",
      "dimension_scores": [
        {
          "dimension": "density",
          "level": 4,
          "comment": "必要な観点はあるが表記が不統一。"
        },
        {
          "dimension": "accuracy",
          "level": 3,
          "comment": "テスト条件としては誤検知の余地がある。"
        }
      ]
    },
    {
      "severity": "low",
      "title": "ブロック境界の例示日付が固定値に見える",
      "body": "ブロック開始条件が `2026-05-03 セッション` を含む行として書かれており、§3.1 の TODAY ベース仕様と同じ意味の例示なのか、実装すべき固定文字列なのかが読み手に依存する。将来日付での idempotency に関わるため、実装前に `${TODAY} セッション` と明示した方がよい。",
      "file": "docs/plans/PLAN-014-stop-hook-idempotency.md",
      "line_start": 61,
      "line_end": 63,
      "confidence": 0.86,
      "recommendation": "境界仕様を『開始: 行頭 `^## ${TODAY} セッション`』のように動的日付前提で書き換え、必要なら date モックで翌日ケースを固定する。",
      "helix_phase": "L4",
      "dimension_scores": [
        {
          "dimension": "accuracy",
          "level": 3,
          "comment": "実装者が固定日付として読める余地がある。"
        },
        {
          "dimension": "maintainability",
          "level": 4,
          "comment": "明記すれば将来日の保守性は十分。"
        }
      ]
    }
  ],
  "next_steps": [
    "PLAN 方向性は approve とし、L4 着手前に G3/G4 の詳細として atomic rewrite 方針と日付別検証期待値を明文化する。",
    "bats スケルトン作成前に新ヘッダ regex、旧フォーマット互換 assertion、date モック時の対象ファイル/ブロック数を揃える。"
  ]
}
